{
  "$schema": "../schemas/window-taxonomy.v0.json",
  "schema_version": "window-taxonomy.v0",
  "updated": "2026-04-30",
  "description": "Tracked public-site window taxonomy. This policy defines canonical window titles, page-role expectations, and advisory rename aliases for authority tooling.",
  "global_titles": [
    "Metadata",
    "Main Claim",
    "What It Is",
    "Why It Matters",
    "Source Trail",
    "Verification Trail",
    "Definitions",
    "Related Terms",
    "Related Posts",
    "Related Project",
    "Related Projects",
    "Preferred Citation"
  ],
  "roles": {
    "home": {
      "description": "Homepage / first public orientation surface.",
      "required_titles": ["Now", "Start Here", "Current Focus"],
      "allowed_titles": ["Reading Guidance", "Related Terms", "Recent Notes"],
      "allow_page_title_window": false,
      "allow_expressive_titles": false
    },
    "section_index": {
      "description": "Generic section index page.",
      "required_titles": ["Section Summary"],
      "allowed_titles": [
        "Current Status",
        "Current Focus",
        "Public Scope",
        "Public Entry Points",
        "Reading Guidance",
        "Personal Cartoon Rules",
        "Related Terms",
        "Tracks"
      ],
      "allow_page_title_window": true,
      "allow_expressive_titles": false
    },
    "toy_index": {
      "description": "Index of interactive toy notes.",
      "required_titles": ["Toy Index"],
      "allowed_titles": ["Section Summary", "Current Status", "Related Terms"],
      "allow_page_title_window": true,
      "allow_expressive_titles": false
    },
    "tool_index": {
      "description": "Index of repo-backed public tools.",
      "required_titles": ["Tool Index"],
      "allowed_titles": ["Section Summary", "Publication Boundary"],
      "allow_page_title_window": true,
      "allow_expressive_titles": false
    },
    "blog_index": {
      "description": "Index of essays, notes, and experiment posts.",
      "required_titles": ["Blog Index"],
      "allowed_titles": [],
      "allow_page_title_window": false,
      "allow_expressive_titles": false
    },
    "redirect_stub": {
      "description": "Old public URL pointer kept for humans and crawlers after a page moves.",
      "required_titles": ["Moved"],
      "allowed_titles": [],
      "allow_page_title_window": false,
      "allow_expressive_titles": false
    },
    "toy_artifact": {
      "description": "Interactive lab toy with a working demo and public source trail.",
      "required_titles": [
        "Live Toy",
        "Metadata",
        "Main Claim",
        "What Changes On Screen",
        "Why It Matters",
        "Demo Parameters",
        "Source Trail",
        "Related Terms",
        "Preferred Citation"
      ],
      "allowed_titles": [
        "Audio Parameters",
        "Definitions",
        "Easing Formulas",
        "External Implementations",
        "Facts And Definitions",
        "Final Human Framing",
        "Related Project",
        "Technical Parameters"
      ],
      "allow_page_title_window": false,
      "allow_expressive_titles": false
    },
    "tool_artifact": {
      "description": "Repo-backed public tool page.",
      "required_titles": [
        "Metadata",
        "Main Claim",
        "What Is Included",
        "What Is Not Included",
        "Why It Exists",
        "Install And Use",
        "Source Trail",
        "Related Terms",
        "Preferred Citation"
      ],
      "allowed_titles": [
        "Audio Parameters",
        "Demo Parameters",
        "Deployed Lineage",
        "External Implementations",
        "Live Artifact",
        "Technical Parameters",
        "Verification Trail"
      ],
      "allow_page_title_window": false,
      "allow_expressive_titles": false
    },
    "animation_artifact": {
      "description": "Animation or rendered experiment artifact.",
      "required_titles": ["What It Is", "Source Trail", "Related Terms"],
      "allowed_titles": [
        "Audio Parameters",
        "Demo Parameters",
        "Deployed Lineage",
        "Live Artifact",
        "Main Claim",
        "Metadata",
        "Preferred Citation",
        "Render Parameters",
        "Technical Parameters"
      ],
      "allow_page_title_window": true,
      "allow_expressive_titles": false
    },
    "experiment_artifact": {
      "description": "Interactive or playable experiment that is not formalized as a toy or tool.",
      "required_titles": ["What It Is", "Source Trail", "Preferred Citation"],
      "allowed_titles": [
        "Build Notes",
        "Controls",
        "Demo Parameters",
        "Live Artifact",
        "Main Claim",
        "Metadata",
        "Render Parameters",
        "Related Terms",
        "Technical Parameters",
        "Why It Matters"
      ],
      "allow_page_title_window": true,
      "allow_expressive_titles": false
    },
    "identity_resolution": {
      "description": "Identity/disambiguation page for Shane Curry, ChewGum Labs, ChewGum Animation, and related names.",
      "required_titles": [
        "Resolution Summary",
        "Metadata",
        "Entities",
        "External Profiles",
        "Public Proof Trail",
        "Name Collisions",
        "Preferred Naming",
        "Preferred Citation"
      ],
      "allowed_titles": ["Credits Trail", "Public Artifact Anchors", "Related Terms"],
      "allow_page_title_window": true,
      "allow_expressive_titles": false
    },
    "stable_profile": {
      "description": "Stable profile page for Shane Curry and the public work.",
      "required_titles": ["Metadata", "Main Claim", "Public Proof Trail", "Canonical Links", "Preferred Citation"],
      "allowed_titles": [
        "Credits",
        "Current Focus",
        "Profile Facts",
        "Public Scope",
        "Related Entities",
        "Working Facts"
      ],
      "allow_page_title_window": true,
      "allow_expressive_titles": false
    },
    "professional_credits": {
      "description": "Professional credits page.",
      "required_titles": [
        "Metadata",
        "At A Glance",
        "Role Summary",
        "Verification Status",
        "Verification Trail",
        "Preferred Citation"
      ],
      "allowed_titles": ["Credits", "Public Purpose", "Related Terms"],
      "allow_page_title_window": true,
      "allow_project_title_windows": true,
      "allow_expressive_titles": false
    },
    "music_index": {
      "description": "Music section index.",
      "required_titles": [
        "Music Index",
        "Preferred Citation"
      ],
      "allowed_titles": ["Related Pages"],
      "allow_page_title_window": true,
      "allow_expressive_titles": false
    },
    "music_discography": {
      "description": "Album chronology and public album anchors.",
      "required_titles": [
        "Album Index",
        "Date Basis",
        "Source Trail",
        "Preferred Citation"
      ],
      "allowed_titles": [
        "Related Pages"
      ],
      "allow_page_title_window": true,
      "allow_expressive_titles": false
    },
    "music_live_performances": {
      "description": "Index of live music, storytelling, and live coding performance records.",
      "required_titles": [
        "Performance Index",
        "Source Trail",
        "Preferred Citation"
      ],
      "allowed_titles": ["Related Pages"],
      "allow_page_title_window": true,
      "allow_expressive_titles": false
    },
    "music_live_performance": {
      "description": "Single live music, storytelling, or live coding performance record.",
      "required_titles": [
        "Video",
        "Metadata",
        "Performance Notes",
        "Source Trail",
        "Preferred Citation"
      ],
      "allowed_titles": ["Claim Boundary", "Performance Summary", "Related Pages"],
      "allow_page_title_window": true,
      "allow_expressive_titles": false
    },
    "music_streaming_links": {
      "description": "Public music-platform link index.",
      "required_titles": [
        "Catalog Surfaces",
        "Claim Boundary",
        "Source Trail",
        "Preferred Citation"
      ],
      "allowed_titles": ["Related Pages"],
      "allow_page_title_window": true,
      "allow_expressive_titles": false
    },
    "music_media_uses": {
      "description": "Index of external media uses of Shane Curry music.",
      "required_titles": [
        "Current Uses",
        "Source Trail",
        "Preferred Citation"
      ],
      "allowed_titles": ["Related Pages"],
      "allow_page_title_window": true,
      "allow_expressive_titles": false
    },
    "music_media_use": {
      "description": "Single external media-use proof page.",
      "required_titles": [
        "Music Credit",
        "External Implementations",
        "Metadata",
        "Source Trail",
        "Preferred Citation"
      ],
      "allowed_titles": ["Related Pages"],
      "allow_page_title_window": true,
      "allow_expressive_titles": false
    },
    "animation_cartoon_index": {
      "description": "Index of watchable cartoon and animation-video entries.",
      "required_titles": [
        "Cartoon Index",
        "Source Trail",
        "Preferred Citation"
      ],
      "allowed_titles": ["Related Pages"],
      "allow_page_title_window": true,
      "allow_expressive_titles": false
    },
    "animation_cartoon": {
      "description": "Single watchable cartoon or animation-video entry.",
      "required_titles": [
        "Video",
        "Metadata",
        "Source Trail",
        "Preferred Citation"
      ],
      "allowed_titles": ["Campaign Context", "Claim Boundary", "Festival Context", "Production Notes", "Public Cartoon Surfaces", "Related Pages"],
      "allow_page_title_window": true,
      "allow_expressive_titles": false
    },
    "external_links": {
      "description": "Local landing page for outbound profile and proof links.",
      "required_titles": [